[
  {
    "id": "bow_shortbow",
    "name": "Krótki Łuk",
    "description": "Prosty, mały łuk. Nie robi wrażenia, ale strzała z niego wciąż zabija.",
    "category": "weapon_bow",
    "value": 30,
    "weight": 1.0,
    "icon": "bow_shortbow",
    "asset_path": "sprites/items/bow_shortbow.png",
    "damage": 6,
    "damage_type": "physical",
    "draw_time": 800,
    "range": 200,
    "dexterity_scaling": 0.5,
    "requirements": { "dexterity": 5 }
  },
  {
    "id": "bow_hunting_bow",
    "name": "Łuk Myśliwski",
    "description": "Solidny, wyważony łuk do polowań. Ulubiony przez tropicieli Boru Bezgłosu.",
    "category": "weapon_bow",
    "value": 80,
    "weight": 1.5,
    "icon": "bow_hunting_bow",
    "asset_path": "sprites/items/bow_hunting_bow.png",
    "damage": 11,
    "damage_type": "physical",
    "draw_time": 1000,
    "range": 280,
    "dexterity_scaling": 0.65,
    "requirements": { "dexterity": 12 }
  },
  {
    "id": "bow_longbow",
    "name": "Długi Łuk",
    "description": "Łuk na wysokość człowieka. Potrzeba siły, by go napiąć, ale strzała przebija zbroję.",
    "category": "weapon_bow",
    "value": 200,
    "weight": 2.0,
    "icon": "bow_longbow",
    "asset_path": "sprites/items/bow_longbow.png",
    "damage": 18,
    "damage_type": "physical",
    "draw_time": 1400,
    "range": 350,
    "dexterity_scaling": 0.8,
    "requirements": { "dexterity": 20 }
  },
  {
    "id": "bow_crossbow",
    "name": "Kusza",
    "description": "Mechaniczna kusza na podb ramieniu. Celna, potężna, ale powolna w naciągu.",
    "category": "weapon_bow",
    "value": 350,
    "weight": 3.5,
    "icon": "bow_crossbow",
    "asset_path": "sprites/items/bow_crossbow.png",
    "damage": 25,
    "damage_type": "physical",
    "draw_time": 2000,
    "range": 300,
    "dexterity_scaling": 0.5,
    "requirements": { "dexterity": 15, "strength": 15 }
  },
  {
    "id": "bow_recurve",
    "name": "Łuk Refleksyjny",
    "description": "Szybki, krótki łuk z wygiętymi ramionami. Idealny dla jeźdźców i zwiadowców.",
    "category": "weapon_bow",
    "value": 150,
    "weight": 1.2,
    "icon": "bow_recurve",
    "asset_path": "sprites/items/bow_recurve.png",
    "damage": 9,
    "damage_type": "physical",
    "draw_time": 600,
    "range": 220,
    "dexterity_scaling": 0.6,
    "requirements": { "dexterity": 10 }
  },
  {
    "id": "bow_ash_bow",
    "name": "Jesionowy Łuk",
    "description": "Prosty łuk z jesionu. Siła w prostocie.",
    "category": "weapon_bow", "value": 50, "weight": 1.2, "icon": "bow_ash_bow",
    "asset_path": "sprites/items/bow_ash_bow.png",
    "damage": 7, "damage_type": "physical", "draw_time": 900, "range": 240, "dexterity_scaling": 0.55,
    "requirements": { "dexterity": 8 }
  },
  {
    "id": "bow_war_bow",
    "name": "Łuk Wojenny",
    "description": "Łuk wzmacniany kością. Używany przez wojowników Straży.",
    "category": "weapon_bow", "value": 250, "weight": 2.2, "icon": "bow_war_bow",
    "asset_path": "sprites/items/bow_war_bow.png",
    "damage": 20, "damage_type": "physical", "draw_time": 1500, "range": 320, "dexterity_scaling": 0.75,
    "requirements": { "dexterity": 18, "strength": 12 }
  },
  {
    "id": "bow_dark_yew",
    "name": "Cisowy Łuk",
    "description": "Łuk z czarnego cisu. Szybki i cichy.",
    "category": "weapon_bow", "value": 180, "weight": 1.0, "icon": "bow_dark_yew",
    "asset_path": "sprites/items/bow_dark_yew.png",
    "damage": 12, "damage_type": "physical", "draw_time": 700, "range": 260, "dexterity_scaling": 0.6,
    "requirements": { "dexterity": 14 }
  },
  {
    "id": "bow_composite",
    "name": "Łuk Kompozytowy",
    "description": "Misternie wykonany łuk z kilku warstw drewna i ścięgien.",
    "category": "weapon_bow", "value": 300, "weight": 1.8, "icon": "bow_composite",
    "asset_path": "sprites/items/bow_composite.png",
    "damage": 22, "damage_type": "physical", "draw_time": 1100, "range": 340, "dexterity_scaling": 0.8,
    "requirements": { "dexterity": 22 }
  },
  {
    "id": "bow_short_elk",
    "name": "Łośny Róg",
    "description": "Łuk z rogu i drewna. Mały, ale celny.",
    "category": "weapon_bow", "value": 100, "weight": 0.8, "icon": "bow_short_elk",
    "asset_path": "sprites/items/bow_short_elk.png",
    "damage": 8, "damage_type": "physical", "draw_time": 500, "range": 200, "dexterity_scaling": 0.5,
    "requirements": { "dexterity": 6 }
  }
]
